{
  "confidence": "review-required",
  "errors": [],
  "host": "codex",
  "output_path": "staging/codex/20260410T035102Z-compile-63df86ea.md",
  "run_id": "20260410T035102Z-compile-63df86ea",
  "schema_version": 1,
  "source_references": [
    "raw/openai-harness-engineering.md"
  ],
  "status": "succeeded"
}
